{
  "schemaVersion": "dauva.dev/seed-proof/v1",
  "seedId": "satisfactory",
  "seedVersion": "1.0.1-rc.1",
  "result": "passed",
  "provedAt": "2026-07-30T19:49:14.4266036+00:00",
  "leaf": "proof-satisfactory-101rc1",
  "checks": {
    "imagesPinned": true,
    "healthy": true,
    "ports": true,
    "backup": true,
    "gracefulStop": true,
    "restart": true,
    "persistence": true,
    "cleanup": true,
    "runtimeVersion": true,
    "managedUpdate": true,
    "rollback": true
  },
  "agreements": [
    {
      "key": "accept-steam-agreement",
      "url": "https://store.steampowered.com/subscriber_agreement/",
      "revision": "official-current",
      "accepted": true
    }
  ],
  "evidence": {
    "seedManifest": "sha256:c5a2390802f50d3d24b4d474c412e68a9d6d5173a6a7be394db0a38fb314a51e",
    "registry": "sha256:a479b4489078789f19bfd1ef611422f18aaaaae41cb5b133765bf3d2131d8283",
    "agent": "0.11.0",
    "sprout": "The Server was Sprouted on Dauva's native Docker Branch.",
    "initialHealth": "The Server completed its health checks and is ready.",
    "stabilitySeconds": "20",
    "runtimeDetection": "detected",
    "runtimeChannel": "stable",
    "runtimeGameVersion": "1.2.0",
    "runtimeUpstreamBuild": "23855705",
    "runtimeSource": "steam-app-manifest+satisfactory-container-log",
    "backup": "The Leaf created a local restore point. It is not disaster-safe because it shares the active-data filesystem.",
    "persistenceVolume": "config",
    "normalRestartUpdatePolicy": "SKIPUPDATE=true",
    "normalRestartBuild": "23855705",
    "restart": "The Server completed its health checks and is ready.",
    "managedUpdate": "already-current: The Server was verified on game build 23855705; it was already current.",
    "managedUpdateOperation": "cfb9eeff-d72f-4c1b-bedd-85f27671641a",
    "managedUpdateBuild": "23855705",
    "rollback": "proof-health-failed: The disposable proof deliberately rejected the healthy post-update runtime so Dauva could prove automatic rollback. Dauva restored the safety backup and the previous Server state.",
    "rollbackOperation": "73f0b267-724a-41a8-ac24-43dee011ffb4",
    "rollbackBuild": "23855705",
    "cleanup": "The Server, its components, and its native Dauva storage were permanently deleted. Backups removed: True."
  }
}
