{
  "schemaVersion": "dauva.dev/seed-proof/v1",
  "seedId": "project-zomboid-community",
  "seedVersion": "1.0.0-rc.1",
  "result": "passed",
  "provedAt": "2026-07-26T01:50:57.4407996+00:00",
  "leaf": "j-hoef-debian-proof",
  "checks": {
    "imagesPinned": true,
    "healthy": true,
    "ports": true,
    "backup": true,
    "gracefulStop": true,
    "restart": true,
    "persistence": true,
    "cleanup": true
  },
  "agreements": [
    {
      "key": "accept-steam-agreement",
      "url": "https://store.steampowered.com/subscriber_agreement/",
      "revision": "official-current",
      "accepted": true
    }
  ],
  "evidence": {
    "seedManifest": "sha256:4b8ed91b3477a42e755d7f5e7f49290ab424153d93ed1494b95cbaaf55e07153",
    "registry": "sha256:552aa69ab03da46a57ae424ecf9c57d0b06a2825a2bbedfc080d573ccf207685",
    "agent": "0.1.0",
    "sprout": "The Server was Sprouted on Dauva's native Docker Branch.",
    "initialHealth": "The native Docker Server is ready.",
    "stabilitySeconds": "20",
    "persistenceVolume": "zomboid",
    "restart": "The native Docker Server is ready.",
    "cleanup": "The Server, its components, and its native Dauva storage were permanently deleted."
  }
}
