{
  "schemaVersion": "dauva.dev/seed-proof/v1",
  "seedId": "enshrouded-wine",
  "seedVersion": "1.0.0",
  "result": "passed",
  "provedAt": "2026-07-30T23:26:07.8521358+00:00",
  "leaf": "primary-leaf",
  "checks": {
    "imagesPinned": true,
    "healthy": true,
    "ports": true,
    "backup": true,
    "gracefulStop": true,
    "restart": true,
    "persistence": true,
    "cleanup": true
  },
  "agreements": [
    {
      "key": "accept-steam-agreement",
      "url": "https://store.steampowered.com/subscriber_agreement/",
      "revision": "official-current",
      "accepted": true
    }
  ],
  "evidence": {
    "seedManifest": "sha256:b95e8b6320df36563fbe8af5028144830143f18037d303c34d6ff617f1b46813",
    "registry": "sha256:7607e48e03f0ad0b075f4b46507bdfa636eedfa5af64bce9264b43fb5b123776",
    "agent": "0.12.1",
    "sprout": "The Server was Sprouted on Dauva's native Docker Branch.",
    "initialHealth": "The Server completed its health checks and is ready.",
    "stabilitySeconds": "20",
    "backup": "The Leaf created a durable backup.",
    "persistenceVolume": "data",
    "restart": "The Server completed its health checks and is ready.",
    "cleanup": "The Server, its components, and its native Dauva storage were permanently deleted. Backups removed: True."
  }
}
