{
  "schemaVersion": "dauva.dev/seed-proof/v1",
  "seedId": "core-keeper",
  "seedVersion": "1.0.2-rc.1",
  "result": "passed",
  "provedAt": "2026-07-30T23:21:43.9296733+00:00",
  "leaf": "proof-core-keeper-102rc1",
  "checks": {
    "imagesPinned": true,
    "healthy": true,
    "ports": true,
    "backup": true,
    "gracefulStop": true,
    "restart": true,
    "persistence": true,
    "cleanup": true
  },
  "agreements": [
    {
      "key": "accept-steam-agreement",
      "url": "https://store.steampowered.com/subscriber_agreement/",
      "revision": "official-current",
      "accepted": true
    }
  ],
  "evidence": {
    "seedManifest": "sha256:c4b29dc5e5cdbc7377fabf88895e73a394271bb431f5b8564addbaad543e866c",
    "registry": "sha256:c7e362d510d2807a5b6a903930ffd1b5743c6866dbdd598a177b43a6ffea787f",
    "agent": "0.12.1",
    "sprout": "The Server was Sprouted on Dauva's native Docker Branch.",
    "initialHealth": "The Server completed its health checks and is ready.",
    "stabilitySeconds": "20",
    "persistenceVolume": "data",
    "restart": "The Server completed its health checks and is ready.",
    "cleanup": "The Server, its components, and its native Dauva storage were permanently deleted. Backups removed: True."
  }
}
